{
  "id": "summer-breeze-2027",
  "name": "Summer Breeze",
  "version": 1,
  "year": 2027,
  "defaultLang": "en",
  "visible": false,
  "runningOrderExists": false,
  "utcOffsetHours": 2,
  "festivalDays": [
    "2027-08-18",
    "2027-08-19",
    "2027-08-20",
    "2027-08-21"
  ],
  "stages": [
    {
      "id": "s1",
      "name": "Main Stage"
    },
    {
      "id": "s2",
      "name": "T-Stage"
    },
    {
      "id": "s3",
      "name": "Tool Rebel Stage"
    },
    {
      "id": "s4",
      "name": "Campsite Circus Stage"
    }
  ],
  "news": [],
  "links": [
    {
      "id": "l1",
      "label": "Website",
      "url": "https://www.summer-breeze.de/en/",
      "type": "web"
    },
    {
      "id": "l2",
      "label": "Tickets",
      "url": "https://www.sbtix.de/tickets",
      "type": "web"
    },
    {
      "id": "l3",
      "label": "Merchandise",
      "url": "https://www.sbtix.de/products",
      "type": "web"
    },
    {
      "id": "l4",
      "label": "Instagram",
      "url": "https://www.instagram.com/summerbreezeopenair/",
      "type": "instagram"
    },
    {
      "id": "l5",
      "label": "YouTube",
      "url": "https://www.youtube.com/c/summerbreeze",
      "type": "youtube"
    },
    {
      "id": "l6",
      "label": "Facebook",
      "url": "https://www.facebook.com/summerbreeze1997",
      "type": "facebook"
    },
    {
      "id": "l7",
      "label": "TikTok",
      "url": "https://www.tiktok.com/@summerbreezeopenair",
      "type": "tiktok"
    },
    {
      "id": "l8",
      "label": "Bluesky",
      "url": "https://bsky.app/profile/summerbreeze.bsky.social"
    },
    {
      "id": "l9",
      "label": "Threads",
      "url": "https://www.threads.net/@summerbreezeopenair"
    },
    {
      "id": "l_sp_electric-callboy",
      "label": "Spotify",
      "url": "https://open.spotify.com/artist/1WNoKxsp715jez1Td4vthc",
      "type": "spotify",
      "artistId": "electric-callboy"
    },
    {
      "id": "l_sp_edguy",
      "label": "Spotify",
      "url": "https://open.spotify.com/artist/3AGFqPP3gt5rMSvhR87Xxu",
      "type": "spotify",
      "artistId": "edguy"
    },
    {
      "id": "l_sp_saltatio-mortis",
      "label": "Spotify",
      "url": "https://open.spotify.com/artist/09Z51O0q4AwHl7FjUUlFKw",
      "type": "spotify",
      "artistId": "saltatio-mortis"
    },
    {
      "id": "l_sp_children-of-bodom",
      "label": "Spotify",
      "url": "https://open.spotify.com/artist/1xUhNgw4eJDZfvumIpcz1B",
      "type": "spotify",
      "artistId": "children-of-bodom"
    },
    {
      "id": "l_sp_hammerfall",
      "label": "Spotify",
      "url": "https://open.spotify.com/artist/2o18h28enlHxj887tATc58",
      "type": "spotify",
      "artistId": "hammerfall"
    },
    {
      "id": "l_sp_halestorm",
      "label": "Spotify",
      "url": "https://open.spotify.com/artist/6om12Ev5ppgoMy3OYSoech",
      "type": "spotify",
      "artistId": "halestorm"
    },
    {
      "id": "l_sp_wind-rose",
      "label": "Spotify",
      "url": "https://open.spotify.com/artist/67ps5pbKVO7V9Fcb4lTIXz",
      "type": "spotify",
      "artistId": "wind-rose"
    },
    {
      "id": "l_sp_lord-of-the-lost",
      "label": "Spotify",
      "url": "https://open.spotify.com/artist/28eLrVsohdXynlnIzQ2VvI",
      "type": "spotify",
      "artistId": "lord-of-the-lost"
    },
    {
      "id": "l_sp_eluveitie",
      "label": "Spotify",
      "url": "https://open.spotify.com/artist/5X0N2k3qMnI8kSrGJT3kfT",
      "type": "spotify",
      "artistId": "eluveitie"
    },
    {
      "id": "l_sp_h-blockx",
      "label": "Spotify",
      "url": "https://open.spotify.com/artist/1V3Nl0Y3EZwqP38KHws6vB",
      "type": "spotify",
      "artistId": "h-blockx"
    },
    {
      "id": "l_sp_swiss-die-andern",
      "label": "Spotify",
      "url": "https://open.spotify.com/artist/3d8f0YBZivistZ4Ohauncb",
      "type": "spotify",
      "artistId": "swiss-die-andern"
    },
    {
      "id": "l_sp_clawfinger",
      "label": "Spotify",
      "url": "https://open.spotify.com/artist/1xE3snzm12GBK259IqEFlY",
      "type": "spotify",
      "artistId": "clawfinger"
    },
    {
      "id": "l_sp_kataklysm",
      "label": "Spotify",
      "url": "https://open.spotify.com/artist/7kozeGeawfP7IEEL6dddrM",
      "type": "spotify",
      "artistId": "kataklysm"
    },
    {
      "id": "l_sp_mono-inc",
      "label": "Spotify",
      "url": "https://open.spotify.com/artist/1189BemPY7h2lgaH1pkzGX",
      "type": "spotify",
      "artistId": "mono-inc"
    },
    {
      "id": "l_sp_warkings",
      "label": "Spotify",
      "url": "https://open.spotify.com/artist/7DXUeaMULtMVFmmaKFzH3E",
      "type": "spotify",
      "artistId": "warkings"
    },
    {
      "id": "l_sp_dark-funeral",
      "label": "Spotify",
      "url": "https://open.spotify.com/artist/21ojeH5LNADIGzJKc3hIlE",
      "type": "spotify",
      "artistId": "dark-funeral"
    },
    {
      "id": "l_sp_gloryhammer",
      "label": "Spotify",
      "url": "https://open.spotify.com/artist/7dkEByOe0oHqc54qU4hwzV",
      "type": "spotify",
      "artistId": "gloryhammer"
    },
    {
      "id": "l_sp_finntroll",
      "label": "Spotify",
      "url": "https://open.spotify.com/artist/4ZgkHVHmGPXuRy8zd26ZJX",
      "type": "spotify",
      "artistId": "finntroll"
    },
    {
      "id": "l_sp_atreyu",
      "label": "Spotify",
      "url": "https://open.spotify.com/artist/3LkSiHbjqOHCKCqBfEZOTv",
      "type": "spotify",
      "artistId": "atreyu"
    },
    {
      "id": "l_sp_shadow-of-intent",
      "label": "Spotify",
      "url": "https://open.spotify.com/artist/76xrrejizyQpKukBIhnf3D",
      "type": "spotify",
      "artistId": "shadow-of-intent"
    },
    {
      "id": "l_sp_emil-bulls",
      "label": "Spotify",
      "url": "https://open.spotify.com/artist/1scIUjz7Jbq1mOph50OLQO",
      "type": "spotify",
      "artistId": "emil-bulls"
    },
    {
      "id": "l_sp_equilibrium",
      "label": "Spotify",
      "url": "https://open.spotify.com/artist/5KvkOKroKLz202ioXfGWR2",
      "type": "spotify",
      "artistId": "equilibrium"
    },
    {
      "id": "l_sp_john-bush",
      "label": "Spotify",
      "url": "https://open.spotify.com/artist/4bKtCAuiawng7u01bT0ElG",
      "type": "spotify",
      "artistId": "john-bush"
    },
    {
      "id": "l_sp_carnifex",
      "label": "Spotify",
      "url": "https://open.spotify.com/artist/4nqY8hkQNkHaDq4fdVxdYr",
      "type": "spotify",
      "artistId": "carnifex"
    },
    {
      "id": "l_sp_the-browning",
      "label": "Spotify",
      "url": "https://open.spotify.com/artist/4DSNcg40nf6T3eNAObq1Lo",
      "type": "spotify",
      "artistId": "the-browning"
    },
    {
      "id": "l_sp_gaerea",
      "label": "Spotify",
      "url": "https://open.spotify.com/artist/1wXoI3Ajpv4WwQ3LmcrSBw",
      "type": "spotify",
      "artistId": "gaerea"
    },
    {
      "id": "l_sp_long-distance-calling",
      "label": "Spotify",
      "url": "https://open.spotify.com/artist/3SiCxhceGZgzusCLHd4Zz6",
      "type": "spotify",
      "artistId": "long-distance-calling"
    },
    {
      "id": "l_sp_make-them-suffer",
      "label": "Spotify",
      "url": "https://open.spotify.com/artist/0FZcPgWI3BsFQl4rOAGSHT",
      "type": "spotify",
      "artistId": "make-them-suffer"
    },
    {
      "id": "l_sp_mittel-alta",
      "label": "Spotify",
      "url": "https://open.spotify.com/artist/2QjjVXLHTBPbpM18ftwvYV",
      "type": "spotify",
      "artistId": "mittel-alta"
    },
    {
      "id": "l_sp_any-given-day",
      "label": "Spotify",
      "url": "https://open.spotify.com/artist/4p6RoajGbtqLSfYZpFxHyU",
      "type": "spotify",
      "artistId": "any-given-day"
    },
    {
      "id": "l_sp_gutalax",
      "label": "Spotify",
      "url": "https://open.spotify.com/artist/5CmgfDQq0YVKMP6zpjYhPR",
      "type": "spotify",
      "artistId": "gutalax"
    },
    {
      "id": "l_sp_blue-medusa",
      "label": "Spotify",
      "url": "https://open.spotify.com/artist/4BMOQ1GSXhTvuv6a05wk7z",
      "type": "spotify",
      "artistId": "blue-medusa"
    },
    {
      "id": "l_sp_insomnium",
      "label": "Spotify",
      "url": "https://open.spotify.com/artist/3uIgLG971oRM5fe6v8lvQS",
      "type": "spotify",
      "artistId": "insomnium"
    },
    {
      "id": "l_sp_combichrist",
      "label": "Spotify",
      "url": "https://open.spotify.com/artist/5556RAgwP70PnXbaUTGNbR",
      "type": "spotify",
      "artistId": "combichrist"
    },
    {
      "id": "l_sp_peeling-flesh",
      "label": "Spotify",
      "url": "https://open.spotify.com/artist/40DbKvYvADTiks7hZIUPHG",
      "type": "spotify",
      "artistId": "peeling-flesh"
    },
    {
      "id": "l_sp_anaal-nathrakh",
      "label": "Spotify",
      "url": "https://open.spotify.com/artist/7vrrJ5YlL3I8XUrh1ktGJV",
      "type": "spotify",
      "artistId": "anaal-nathrakh"
    },
    {
      "id": "l_sp_fleshgod-apocalypse",
      "label": "Spotify",
      "url": "https://open.spotify.com/artist/5ctFffJBdJe8PZL7W7NeML",
      "type": "spotify",
      "artistId": "fleshgod-apocalypse"
    },
    {
      "id": "l_sp_primal-fear",
      "label": "Spotify",
      "url": "https://open.spotify.com/artist/1yfiDL3YUEJlQCgb5Pun6g",
      "type": "spotify",
      "artistId": "primal-fear"
    },
    {
      "id": "l_sp_nasty",
      "label": "Spotify",
      "url": "https://open.spotify.com/artist/7GnX7pGXdWtLObs16B1mFB",
      "type": "spotify",
      "artistId": "nasty"
    },
    {
      "id": "l_sp_burning-witches",
      "label": "Spotify",
      "url": "https://open.spotify.com/artist/0eNuNAhL4dW2nvKbSe2mS8",
      "type": "spotify",
      "artistId": "burning-witches"
    },
    {
      "id": "l_sp_kupfergold",
      "label": "Spotify",
      "url": "https://open.spotify.com/artist/5ziUNRAHfR28SgsINMc66V",
      "type": "spotify",
      "artistId": "kupfergold"
    },
    {
      "id": "l_sp_end-of-green",
      "label": "Spotify",